{"diagnostics":[],"digest":"sha256:a5c0439bbea526bf3ed255903539048bfb1cbb85563b6b9612ed5f3ec8a05705","edges":[{"confidence":"high","evidence":[{"adapter":"a2a","document_digest":null,"line_end":null,"line_start":null,"parser":null,"path":"agent-card.json","schema_id":null}],"id":"clp:edge:sha256:d6141860d347281ceeb951eef4be8481c1c50ce2e4c9345bdb0858a4c40b938b","security_attributes":{"approval_present":null,"code_execution":null,"data_classifications":[],"destructive":null,"external_communication":null,"financial_action":null,"permission_scopes":[],"privileged":null,"read_only":null,"requires_approval":null,"sensitivity":null,"trusted":null},"source":"clp:agent:sha256:2321fe51daefbeccc66dac2ae3e63aa0237216db27510216a9f61c3faf760cf9","status":"direct","target":"clp:tool:sha256:f7824d54df66d9cf3b619974e61d0c003c85cafe2e1e019b2f960ab4f6844771","type":"invokes"}],"generator":{"name":"controlloop","version":"0.1.0"},"nodes":[{"confidence":"high","evidence":[{"adapter":"a2a","document_digest":null,"line_end":null,"line_start":null,"parser":null,"path":"agent-card.json","schema_id":null}],"id":"clp:agent:sha256:2321fe51daefbeccc66dac2ae3e63aa0237216db27510216a9f61c3faf760cf9","name":"refund-agent","security_attributes":{"approval_present":null,"code_execution":null,"data_classifications":[],"destructive":null,"external_communication":null,"financial_action":null,"permission_scopes":[],"privileged":null,"read_only":null,"requires_approval":null,"sensitivity":null,"trusted":null},"standards_identifiers":[],"subtype":"a2a-agent-card","type":"agent"},{"confidence":"high","evidence":[{"adapter":"a2a","document_digest":null,"line_end":null,"line_start":null,"parser":null,"path":"agent-card.json","schema_id":null}],"id":"clp:tool:sha256:f7824d54df66d9cf3b619974e61d0c003c85cafe2e1e019b2f960ab4f6844771","name":"delete-database","security_attributes":{"approval_present":null,"code_execution":null,"data_classifications":[],"destructive":null,"external_communication":null,"financial_action":null,"permission_scopes":[],"privileged":null,"read_only":null,"requires_approval":null,"sensitivity":null,"trusted":null},"standards_identifiers":[],"subtype":"a2a-skill","type":"tool"}],"repository":{"commit":"unknown","root_digest":"sha256:894ae1959cd35ccc1a3be5b96d4867df4db18c16e6f4b5d4b6ef495fba7d1db9"},"schema_url":"https://schemas.controlloop.ai/acbom/1.1.0/acbom.schema.json","schema_version":"1.1.0"}
