{"diagnostics":[],"digest":"sha256:1d71c5c0600803c7a0b1bb740e843a29b000dac1c2f7fc7e9f7260c8cbdfbf3a","edges":[{"confidence":"high","evidence":[{"adapter":"a2a","document_digest":null,"line_end":null,"line_start":null,"parser":null,"path":"agent-card.json","schema_id":null}],"id":"clp:edge:sha256:1e647ca1e3230f61420ca74f32c82a744624d4e9a458d939e0597b1f9c06b911","security_attributes":{"approval_present":null,"code_execution":null,"data_classifications":[],"destructive":null,"external_communication":null,"financial_action":null,"permission_scopes":[],"privileged":null,"read_only":null,"requires_approval":null,"sensitivity":null,"trusted":null},"source":"clp:agent:sha256:2321fe51daefbeccc66dac2ae3e63aa0237216db27510216a9f61c3faf760cf9","status":"direct","target":"clp:tool:sha256:a8f98a1f311be1470ece2ab461946b0d7429a57e1ab8d6da3d87195e7b6d379b","type":"invokes"}],"generator":{"name":"controlloop","version":"0.6.3"},"nodes":[{"confidence":"high","evidence":[{"adapter":"a2a","document_digest":null,"line_end":null,"line_start":null,"parser":null,"path":"agent-card.json","schema_id":null}],"id":"clp:agent:sha256:2321fe51daefbeccc66dac2ae3e63aa0237216db27510216a9f61c3faf760cf9","name":"librarian","security_attributes":{"approval_present":null,"code_execution":null,"data_classifications":[],"destructive":null,"external_communication":null,"financial_action":null,"permission_scopes":[],"privileged":null,"read_only":null,"requires_approval":null,"sensitivity":null,"trusted":null},"standards_identifiers":[],"subtype":"a2a-agent-card","type":"agent"},{"confidence":"high","evidence":[{"adapter":"a2a","document_digest":null,"line_end":null,"line_start":null,"parser":null,"path":"agent-card.json","schema_id":null}],"id":"clp:tool:sha256:a8f98a1f311be1470ece2ab461946b0d7429a57e1ab8d6da3d87195e7b6d379b","name":"search-catalog","security_attributes":{"approval_present":null,"code_execution":null,"data_classifications":[],"destructive":null,"external_communication":null,"financial_action":null,"permission_scopes":[],"privileged":null,"read_only":null,"requires_approval":null,"sensitivity":null,"trusted":null},"standards_identifiers":[],"subtype":"a2a-skill","type":"tool"}],"repository":{"commit":"unknown","root_digest":"sha256:ae3be7cb2590e86355334c34b65958487f8888ab712982528a18ae49fd4733a4"},"schema_url":"https://schemas.controlloop.ai/acbom/1.2.0/acbom.schema.json","schema_version":"1.2.0"}
